{
  "$schema": "http://json-schema.org/draft-07/schema#",
  "title": "RunContext",
  "description": "Orchestrator run context. Written at the start of Stage A and referenced by all subsequent stages.",
  "type": "object",
  "additionalProperties": true,
  "required": ["run_id", "started_at", "input_refs"],

  "properties": {
    "run_id": {
      "type": "string",
      "description": "Unique run identifier (UUID4)."
    },
    "run_label": {
      "type": ["string", "null"],
      "description": "Optional human-readable label for the run."
    },
    "started_at": {
      "type": "string",
      "format": "date-time",
      "description": "ISO-8601 timestamp when the run was initiated."
    },
    "config": {
      "type": "object",
      "description": "Orchestrator configuration snapshot for this run.",
      "additionalProperties": true,
      "properties": {
        "enable_ishikawa":                  { "type": "boolean" },
        "persist_intermediate_artifacts":   { "type": "boolean" },
        "stop_on_validation_error":         { "type": "boolean" },
        "top_k_candidates":                 { "type": "integer" },
        "top_k_evidence":                   { "type": "integer" }
      }
    },
    "input_refs": {
      "type": "object",
      "description": "References to the primary inputs used in this run.",
      "additionalProperties": true,
      "required": ["event_id", "asset_id"],
      "properties": {
        "event_id":               { "type": ["string", "null"] },
        "asset_id":               { "type": ["string", "null"] },
        "telemetry_asset_id":     { "type": ["string", "null"] },
        "has_operational_context":{ "type": "boolean" },
        "has_pm_compliance":      { "type": "boolean" }
      }
    },
    "validation": {
      "type": "object",
      "description": "Input validation report for this run.",
      "additionalProperties": true
    }
  }
}
