{
  "run_id": "faa22b2f-82c4-4ae0-8301-7c5f95b5a9ab",
  "run_label": "dev-local",
  "started_at": "2026-03-26T20:06:21.164604+00:00",
  "config": {
    "enable_ishikawa": true,
    "persist_intermediate_artifacts": true,
    "stop_on_validation_error": false,
    "top_k_candidates": 5,
    "top_k_evidence": 8,
    "validator_mode": "compat",
    "schema_dir": "../schemas"
  },
  "input_refs": {
    "event_id": "E2026-01-23-001",
    "asset_id": "PUMP_A_01",
    "telemetry_asset_id": "PUMP_A_01",
    "has_operational_context": false,
    "has_pm_compliance": false
  },
  "validation": {
    "inputs": {
      "ok": true,
      "issues": [],
      "artifact": "bundle:inputs"
    }
  }
}