{
  "run_id": "96fa19ac-d7f1-4316-9e04-7b1b81f52e80",
  "run_label": "dev-local",
  "started_at": "2026-03-26T23:24:59.442097+00:00",
  "config": {
    "enable_ishikawa": true,
    "persist_intermediate_artifacts": true,
    "stop_on_validation_error": false,
    "top_k_candidates": 5,
    "top_k_evidence": 8,
    "validator_mode": "compat",
    "schema_dir": "/Users/mandd/projects/DACKAR/src/dackar/RCA/schemas"
  },
  "input_refs": {
    "event_id": "E2026-04-15-001",
    "asset_id": "CONDENSER_TRAIN_A",
    "telemetry_asset_id": "CONDENSER_TRAIN_A",
    "has_operational_context": true,
    "has_pm_compliance": true
  },
  "validation": {
    "inputs": {
      "ok": false,
      "issues": [
        {
          "artifact": "telemetry_summary",
          "severity": "error",
          "code": "schema_validation_error",
          "message": "'drift' is not one of ['step_change', 'gradual_drift', 'spike', 'oscillation', 'dropout', 'sustained_exceedance', 'unknown']",
          "path": [
            "signals",
            "0",
            "anomalies",
            "0",
            "pattern"
          ]
        },
        {
          "artifact": "telemetry_summary",
          "severity": "error",
          "code": "schema_validation_error",
          "message": "'drift' is not one of ['step_change', 'gradual_drift', 'spike', 'oscillation', 'dropout', 'sustained_exceedance', 'unknown']",
          "path": [
            "signals",
            "1",
            "anomalies",
            "0",
            "pattern"
          ]
        },
        {
          "artifact": "telemetry_summary",
          "severity": "error",
          "code": "schema_validation_error",
          "message": "'drift' is not one of ['step_change', 'gradual_drift', 'spike', 'oscillation', 'dropout', 'sustained_exceedance', 'unknown']",
          "path": [
            "signals",
            "5",
            "anomalies",
            "0",
            "pattern"
          ]
        },
        {
          "artifact": "operational_context",
          "severity": "error",
          "code": "schema_validation_error",
          "message": "Additional properties are not allowed ('ambient_conditions', 'constraints', 'event_id', 'power_level_percent', 'unit_mode' were unexpected)",
          "path": []
        },
        {
          "artifact": "operational_context",
          "severity": "error",
          "code": "schema_validation_error",
          "message": "'window' is a required property",
          "path": []
        },
        {
          "artifact": "operational_context",
          "severity": "error",
          "code": "schema_validation_error",
          "message": "'mode' is a required property",
          "path": []
        },
        {
          "artifact": "pm_compliance",
          "severity": "error",
          "code": "schema_validation_error",
          "message": "Additional properties are not allowed ('completed_recent_tasks', 'compliance_status', 'event_id', 'overdue_tasks' were unexpected)",
          "path": []
        },
        {
          "artifact": "pm_compliance",
          "severity": "error",
          "code": "schema_validation_error",
          "message": "'window' is a required property",
          "path": []
        },
        {
          "artifact": "pm_compliance",
          "severity": "error",
          "code": "schema_validation_error",
          "message": "'checks' is a required property",
          "path": []
        },
        {
          "artifact": "pm_compliance",
          "severity": "error",
          "code": "schema_validation_error",
          "message": "'summary' is a required property",
          "path": []
        }
      ],
      "artifact": "bundle:inputs"
    }
  }
}