{
  "run_id": "4a59a74a-0500-4457-93ce-89351bb71660",
  "run_label": "dev-local",
  "started_at": "2026-04-07T16:38:19.591676+00:00",
  "config": {
    "enable_ishikawa": true,
    "persist_intermediate_artifacts": true,
    "stop_on_validation_error": false,
    "top_k_candidates": 5,
    "top_k_evidence": 8,
    "validator_mode": "compat",
    "schema_dir": "/Users/mandd/projects/DACKAR/src/dackar/RCA/schemas",
    "causality_engine_version": "v31"
  },
  "input_refs": {
    "event_id": "EVT-U2-2024-0847",
    "asset_id": "U2-CONDENSER-MAIN",
    "telemetry_asset_id": "U2-CONDENSER-MAIN",
    "has_operational_context": true,
    "has_pm_compliance": true
  },
  "validation": {
    "inputs": {
      "ok": false,
      "issues": [
        {
          "artifact": "event",
          "severity": "error",
          "code": "schema_validation_error",
          "message": "'chemistry' is not one of ['vibration', 'temperature', 'pressure', 'flow', 'noise', 'leakage', 'electrical', 'control_signal', 'structural', 'other']",
          "path": [
            "symptom_signature",
            "symptom_types",
            "1"
          ]
        },
        {
          "artifact": "telemetry_summary",
          "severity": "error",
          "code": "schema_validation_error",
          "message": "Additional properties are not allowed ('score', 'severity' were unexpected)",
          "path": [
            "signals",
            "0",
            "anomalies",
            "0"
          ]
        },
        {
          "artifact": "telemetry_summary",
          "severity": "error",
          "code": "schema_validation_error",
          "message": "'changepoint_detection' is not one of ['matrix_profile', 'threshold_exceedance', 'baseline_deviation', 'changepoint', 'other']",
          "path": [
            "signals",
            "0",
            "anomalies",
            "0",
            "detection_method"
          ]
        },
        {
          "artifact": "telemetry_summary",
          "severity": "error",
          "code": "schema_validation_error",
          "message": "Additional properties are not allowed ('score', 'severity' were unexpected)",
          "path": [
            "signals",
            "0",
            "anomalies",
            "1"
          ]
        },
        {
          "artifact": "telemetry_summary",
          "severity": "error",
          "code": "schema_validation_error",
          "message": "Additional properties are not allowed ('score', 'severity' were unexpected)",
          "path": [
            "signals",
            "1",
            "anomalies",
            "0"
          ]
        },
        {
          "artifact": "telemetry_summary",
          "severity": "error",
          "code": "schema_validation_error",
          "message": "Additional properties are not allowed ('score', 'severity' were unexpected)",
          "path": [
            "signals",
            "1",
            "anomalies",
            "1"
          ]
        },
        {
          "artifact": "telemetry_summary",
          "severity": "error",
          "code": "schema_validation_error",
          "message": "Additional properties are not allowed ('score', 'severity' were unexpected)",
          "path": [
            "signals",
            "2",
            "anomalies",
            "0"
          ]
        },
        {
          "artifact": "telemetry_summary",
          "severity": "error",
          "code": "schema_validation_error",
          "message": "Additional properties are not allowed ('score', 'severity' were unexpected)",
          "path": [
            "signals",
            "3",
            "anomalies",
            "0"
          ]
        },
        {
          "artifact": "telemetry_summary",
          "severity": "error",
          "code": "schema_validation_error",
          "message": "Additional properties are not allowed ('score', 'severity' were unexpected)",
          "path": [
            "signals",
            "4",
            "anomalies",
            "0"
          ]
        },
        {
          "artifact": "operational_context",
          "severity": "error",
          "code": "schema_validation_error",
          "message": "Additional properties are not allowed ('operating_mode' was unexpected)",
          "path": []
        },
        {
          "artifact": "operational_context",
          "severity": "error",
          "code": "schema_validation_error",
          "message": "None is not of type 'string'",
          "path": [
            "nearby_maintenance",
            "1",
            "completed_at"
          ]
        },
        {
          "artifact": "pm_compliance",
          "severity": "error",
          "code": "schema_validation_error",
          "message": "Additional properties are not allowed ('overdue_tasks' was unexpected)",
          "path": []
        }
      ],
      "artifact": "bundle:inputs"
    }
  }
}