{
  "run_id": "7a76ddce-c459-415e-b825-eb07ae090a22",
  "run_label": "dev-local",
  "started_at": "2026-04-13T21:20:19.210993+00:00",
  "config": {
    "enable_ishikawa": true,
    "persist_intermediate_artifacts": true,
    "stop_on_validation_error": false,
    "top_k_candidates": 5,
    "top_k_evidence": 8,
    "validator_mode": "compat",
    "schema_dir": "../../schemas",
    "causality_engine_version": "v31"
  },
  "input_refs": {
    "event_id": "E2026-01-23-001",
    "asset_id": "PUMP_A_01",
    "telemetry_asset_id": "PUMP_A_01",
    "has_operational_context": false,
    "has_pm_compliance": false
  },
  "validation": {
    "inputs": {
      "ok": true,
      "issues": [],
      "artifact": "bundle:inputs"
    }
  }
}