{
  "run_id": "d137b813-0b1a-4667-9dd4-b18e0a8411e4",
  "run_label": "dev-local",
  "started_at": "2026-04-06T15:55:35.903980+00:00",
  "config": {
    "enable_ishikawa": true,
    "persist_intermediate_artifacts": true,
    "stop_on_validation_error": false,
    "top_k_candidates": 5,
    "top_k_evidence": 8,
    "validator_mode": "compat",
    "schema_dir": "/Users/mandd/projects/DACKAR/src/dackar/RCA/schemas",
    "causality_engine_version": "v31"
  },
  "input_refs": {
    "event_id": "E2026-04-15-001",
    "asset_id": "CONDENSER_TRAIN_A",
    "telemetry_asset_id": "CONDENSER_TRAIN_A",
    "has_operational_context": true,
    "has_pm_compliance": true
  },
  "validation": {
    "inputs": {
      "ok": true,
      "issues": [],
      "artifact": "bundle:inputs"
    }
  }
}